B1: MOLE VALLEY ORIENTEERING CLUB | Home Page | The Mole Roll | Event Results | | Permanent O Courses | Your First Orienteering Event | | O Jargon Buster | O Events Calendar | | Join Mole Valley | Club Management | Club Contacts |

A1: Go to top of page. Go to top of home page HANDICAP RESULTS Go to top of page. Go to top of home page

A1: FROLIC NORBURY PARK 08 JULY 2001

A1: jump to orange course results | B1: jump to green course results
A2: jump to FROLIC results
A3: jump to splits for all courses | B3: jump to FROLIC handicap results

B1: ORANGE 3.5km 50m climb 10 controls
B2: 1 | C2: Gibson, Adrian | D2: SPOOK | E2: M21 | F2: 26:22
B3: 2 | C3: Lashbrook, Geoff | D3: SLOW | E3: M21 | F3: 35:50
B4: 3 | C4: Bailey, A | D4: SLOW | E4: M12 | F4: 41:21
B5: 4 | C5: Morrison Family | D5: SLOW | E5: Family | F5: 59:40
B6: 5 | C6: Deacon,Christopher | D6: Ind | E6: M7 | F6: 60:44
B7: 6 | C7: Wood, Catherine | D7: MV | E7: W11 | F7: 66:04
B8: mispunched
C9: Bisley, J | D9: Ind | E9: M21
C10: Rogers,C | D10: SLOW | E10: W21
B12: GREEN 4.0km 120m climb 8 controls
B13: 1 | C13: Gristwood, Graham | D13: MV | E13: M18 | F13: 26:12
B14: 2 | C14: Rollins, Dave | D14: BAOC | E14: M35 | F14: 31:48
B15: 3 | C15: Burton, Tony | D15: MV | E15: M35 | F15: 33:49
B16: 4 | C16: Fox, P | D16: SN | E16: M35 | F16: 34:45
B17: 5 | C17: Rogers,T | D17: SLOW | E17: M21 | F17: 35:36
B18: 6 | C18: Powell, Andrew | D18: MV | E18: M20 | F18: 36:31
B19: 7 | C19: Hickling, Alan | D19: SAX | E19: M35 | F19: 38:08
B20: 8 | C20: Coles,Jon | D20: MV | E20: M21 | F20: 38:40
B21: 9 | C21: Bush, Nigel | D21: MV | E21: M45 | F21: 39:05
B22: 10 | C22: Bateson, Nick | D22: BAOC | E22: M40 | F22: 39:37
B23: 11 | C23: Joyce,Vince | D23: SO | E23: M45 | F23: 40:11
B24: 12 | C24: Townley, Laurence | D24: MV | E24: M21 | F24: 40:46
B25: 13 | C25: Chapman,Peter | D25: SO | E25: M35 | F25: 40:47
B26: 14 | C26: Bryant,Bruce | D26: OD | E26: M40 | F26: 40:48
B27: 15 | C27: Turner,Charlie | D27: SLOW | E27: M45 | F27: 40:53
B28: 16 | C28: Catmur, Richard | D28: SLOW | E28: M45 | F28: 41:54
B29: 17 | C29: Moulding, J | D29: Ind | E29: M21 | F29: 42:26
B30: 18 | C30: Phillips,L | D30: OD | E30: W35 | F30: 42:46
B31: 10 | C31: Annila,R | D31: SOC | E31: W14 | F31: 44:11
B32: 20 | C32: Saunders,D | D32: HH | E32: M40 | F32: 44:24
B33: 21 | C33: High, Darrell | D33: CROC | E33: M21 | F33: 45:40
B34: 22 | C34: Swallow, C | D34: SN | E34: M40 | F34: 46:10
B35: 23 | C35: Skinner, Susan | D35: SN | E35: W35 | F35: 46:18
B36: 24 | C36: Newton, John | D36: RAFO | E36: M40 | F36: 46:25
B37: 25 | C37: Annila,I | D37: SOC | E37: M40 | F37: 46:25
B38: 26 | C38: Normand, G | D38: HH | E38: M55 | F38: 47:24
B39: 27 | C39: Moulding, R | D39: HH | E39: M55 | F39: 47:43
B40: 28 | C40: Hickling, Joanne | D40: SAX | E40: W35 | F40: 49:50
B41: 29 | C41: Rose,L | D41: BADO | E41: M45 | F41: 51:12
B42: 30 | C42: Lenton,S | D42: SO | E42: M21 | F42: 51:54
B43: 31 | C43: Pulford,J | D43: LOK | E43: W21 | F43: 52:22
B44: 32 | C44: Walton, John | D44: SO | E44: M40 | F44: 53:32
B45: 33 | C45: Newton,Geoff | D45: MV | E45: M55 | F45: 53:57
B46: 34 | C46: Underhill, Dylan | D46: DFOK | E46: M21 | F46: 54:30
B47: 35 | C47: Kingdon,David | D47: SAX | E47: M50 | F47: 54:39
B48: 36 | C48: Kingdon,A | D48: SAX | E48: W45 | F48: 55:50
B49: 37 | C49: Jepson,Chris | D49: SO | E49: W40 | F49: 57:26
B50: 38 | C50: Lister, D | D50: SLOW | E50: M21 | F50: 60:21
B51: 39 | C51: Pugh, Tim | D51: GO | E51: M55 | F51: 61:08
B52: 40 | C52: Alexander, William | D52: Ind | E52: M55 | F52: 61:35
B53: 41 | C53: Morrison,A | D53: SLOW | E53: M40 | F53: 62:43
B54: 42 | C54: Turner, Rachel | D54: MV | E54: W21 | F54: 64:07
B55: 43 | C55: Archer, Jane | D55: SN | E55: W45 | F55: 66:21
B56: 44 | C56: Elliott, Andy | D56: CROC | E56: M50 | F56: 67:07
B57: 45 | C57: Duffield, John | D57: CHIG | E57: M50 | F57: 68:12
B58: 46 | C58: Sharp,G | D58: SN | E58: W40 | F58: 68:14
B59: 47 | C59: Grindrod, C | D59: Ind | E59: W35 | F59: 69:21
B60: 48 | C60: McPherson, Ian | D60: Ind | E60: M45 | F60: 69:39
B61: 49 | C61: Powell, Martin | D61: MV | E61: M45 | F61: 70:06
B62: 50 | C62: Stenson, J | D62: SLOW | E62: M35 | F62: 71:37
B63: 51 | C63: Welsh, Rachel | D63: Ind | E63: W30 | F63: 76:42
B64: 52 | C64: Ashcroft, Gavin | D64: SO | E64: M35 | F64: 78:14
B65: 53 | C65: Ashworth, Alex | D65: SLOW | E65: M35 | F65: 83:57
B66: 54 | C66: Ellis, Keith | D66: BKO | E66: M35 | F66: 87:12
B67: 55 | C67: Moffat, S A | D67: Ind | E67: M45 | F67: 88:50
B68: 56 | C68: Webster, Maureen | D68: HH | E68: W50 | F68: 91:19
B69: 57 | C69: Reynolds, D | D69: Ind | E69: M40 | F69: 105:22
B70: 58 | C70: White, Michael | D70: MV | E70: M60 | F70: 108:14
B71: 59 | C71: Manning | D71: Ind | E71: M65 | F71: 110:34
B72: mispunched
C73: MacGregor, Andy | D73: BADO | E73: M60
C74: Normand, P | D74: HH | E74: M21
C75: Lindfield, L | D75: SO | E75: W55
C76: Prowting,Jim | D76: TVOC | E76: M55

B1: FROLIC 3.1km 60m climb 9 controls (light green standard)
B2: 1 | C2: Burton, Tony | D2: MV | E2: M35 | F2: 19:57
B3: 2 | C3: Joyce,Vince | D3: SO | E3: M45 | F3: 23:39
B4: 3 | C4: Ditchfield, Ian | D4: MV | E4: M45 | F4: 24:59
B5: 4 | C5: Gristwood, Graham | D5: MV | E5: M18 | F5: 25:55
B6: 5 | C6: Errington,Simon | D6: HH | E6: M35 | F6: 28:08
B7: 6 | C7: Rogers,T | D7: SLOW | E7: M21 | F7: 29:23
B8: 7 | C8: Pitcher, A | D8: DFOK | E8: M35 | F8: 30:05
B9: 8 | C9: Bush, Nigel | D9: MV | E9: M45 | F9: 30:06
B10: 9 | C10: McKerrow,D | D10: SLOW | E10: M45 | F10: 30:38
B11: 10 | C11: Fox, P | D11: SN | E11: M35 | F11: 30:53
B12: 11 | C12: Moulding, R | D12: HH | E12: M55 | F12: 31:10
B13: 12 | C13: Skinner, Susan | D13: SN | E13: W35 | F13: 31:26
B14: 13 | C14: Cunnane, James | D14: CLYDE | E14: M35 | F14: 32:13
B15: 14 | C15: Chapman,Peter | D15: SO | E15: M35 | F15: 32:17
B16: 15 | C16: Darley, Jon | D16: GO | E16: M35 | F16: 32:48
B17: 16 | C17: Greenwood,Simon | D17: SAX | E17: M45 | F17: 33:03
B18: 17 | C18: Hingley, Angela | D18: GO | E18: W21 | F18: 33:08
B19: 18 | C19: Swallow, C | D19: SN | E19: M40 | F19: 33:11
B20: 19= | C20: Townley, Laurence | D20: MV | E20: M21 | F20: 33:17
B21: 19= | C21: Farmhall, Justin | D21: SO | E21: M21 | F21: 33:17
B22: 21 | C22: Flint, Richard | D22: BKO | E22: M16 | F22: 33:24
B23: 22 | C23: Errington, Helen | D23: HH | E23: W40 | F23: 36:14
B24: 23 | C24: Birdseye, Greg | D24: LOK | E24: M55 | F24: 37:33
B25: 24 | C25: Cheesman, MJ | D25: MV | E25: M21 | F25: 37:42
B26: 25 | C26: Kingdon,A | D26: SAX | E26: W45 | F26: 38:02
B27: 26 | C27: Warren, Ken | D27: TVOC | E27: M40 | F27: 38:04
B28: 27 | C28: Lugton, Barbara | D28: GO | E28: W40 | F28: 39:14
B29: 28= | C29: Evans, Andrew | D29: DFOK | E29: M45 | F29: 39:18
B30: 28= | C30: Kingdon,David | D30: SAX | E30: M50 | F30: 39:18
B31: 30 | C31: Saunders, Alison | D31: HH | E31: W40 | F31: 41:09
B32: 31 | C32: Rose,M | D32: BADO | E32: M16 | F32: 41:26
B33: 32 | C33: Rose, L | D33: BADO | E33: M45 | F33: 41:42
B34: 33 | C34: Davies, John | D34: MV | E34: M60 | F34: 42:04
B35: 34 | C35: Griffiths, Bill | D35: SAX | E35: M50 | F35: 42:48
B36: 35 | C36: Rose, C | D36: BADO | E36: W45 | F36: 43:15
B37: 36 | C37: Buckle, Chris | D37: MV | E37: M45 | F37: 43:21
B38: 37 | C38: Waller, Anthony | D38: HAVOC | E38: M21 | F38: 44:25
B39: 38 | C39: Normand, G | D39: HH | E39: M55 | F39: 44:28
B40: 39 | C40: Thomas, Jenny | D40: SLOW | E40: W21 | F40: 44:36
B41: 40 | C41: Newton, Geoff | D41: MV | E41: M55 | F41: 44:43
B42: 41 | C42: Thomas, David | D42: SN | E42: M65 | F42: 44:51
B43: 42 | C43: Float, David | D43: HAVOC | E43: M21 | F43: 44:56
B44: 43 | C44: Parmenter, G | D44: HAVOC | E44: M55 | F44: 46:24
B45: 44 | C45: Goldingay, H | D45: HH | E45: M50 | F45: 47:09
B46: 45 | C46: McKerrow,A | D46: SLOW | E46: W16 | F46: 48:55
B47: 46 | C47: Sutton,Graham | D47: MV | E47: M50 | F47: 49:23
B48: 47 | C48: Booth,Tim | D48: BKO | E48: M45 | F48: 49:24
B49: 48 | C49: McDonald, T.M. | D49: MV | E49: M55 | F49: 49:34
B50: 49 | C50: Brown, Lesley | D50: HH | E50: W50 | F50: 50:30
B51: 50 | C51: Blundell, Sarah | D51: DFOK | E51: W35 | F51: 50:32
B52: 51 | C52: Walker,Hugh | D52: MV | E52: M45 | F52: 50:40
B53: 52 | C53: Brown, Eric | D53: HH | E53: M50 | F53: 53:05
B54: 53 | C54: Blake, Jack | D54: MV | E54: M75 | F54: 54:43
B55: 54 | C55: Taylor,J | D55: CHIG | E55: W55 | F55: 54:58
B56: 55 | C56: Webster, C P | D56: HH | E56: M50 | F56: 55:03
B57: 56 | C57: Galvin, Catherine | D57: LOK | E57: W35 | F57: 56:16
B58: 57 | C58: Buckle,Martine | D58: MV | E58: W45 | F58: 56:26
B59: 58 | C59: Dunnett, Maurice | D59: MV | E59: M55 | F59: 57:25
B60: 59 | C60: Turner, Teresa | D60: SLOW | E60: W50 | F60: 57:28
B61: 60 | C61: Bush, Cyd | D61: MV | E61: W45 | F61: 58:11
B62: 61 | C62: Steadman,Margaret | D62: MV | E62: W65 | F62: 59:20
B63: 62 | C63: Float, John | D63: HAVOC | E63: M70 | F63: 61:41
B64: 63 | C64: Biggs, Janet | D64: HAVOC | E64: W45 | F64: 62:20
B65: 64 | C65: Barris, R | D65: HH | E65: M65 | F65: 65:10
B66: 65 | C66: Oxburgh, Ursula | D66: SLOW | E66: W65 | F66: 66:17
B67: 66 | C67: Greaves,J | D67: TVOC | E67: M60 | F67: 69:09
B68: 67 | C68: Crisp, Pamela | D68: MV | E68: W50 | F68: 74:38
B69: 68 | C69: Mealin, A | D69: Ind | E69: M35 | F69: 75:53
B70: 69 | C70: Frayne, Ian | D70: Ind | E70: M40 | F70: 76:29
B71: 70 | C71: Goldingay, F | D71: HH | E71: W50 | F71: 82:59
B72: 71 | C72: Turner, M | D72: MV | E72: M70 | F72: 109:30
B73: mispunched
C74: Whitehead, Roy | D74: MV | E74: M70
C75: Normand, P | D75: HH | E75: M21
C76: Walker,Andrew | D76: MV | E76: M14

E1: Time | F1: H'cap | G1: H'cap Time | H1: Points | I1: Speed Order
A2: 1 | B2: Burton, Tony | C2: MV | D2: M35 | E2: 19:57 | F2: 1 | G2: 18:57 | H2: 100 | I2: 1
A3: 2 | B3: Lugton, Barbara | C3: GO | D3: W40 | E3: 39:14 | F3: 19 | G3: 20:14 | H3: 99 | I3: 27
A4: 3 | B4: Joyce,Vince | C4: SO | D4: M45 | E4: 23:39 | F4: 3 | G4: 20:39 | H4: 98 | I4: 2
A5: 4 | B5: Ditchfield, Ian | C5: MV | D5: M45 | E5: 24:59 | F5: 3 | G5: 21:59 | H5: 97 | I5: 3
A6: 5 | B6: Gristwood, Graham | C6: MV | D6: M18 | E6: 25:55 | F6: 3 | G6: 22:55 | H6: 96 | I6: 4
A7: 6 | B7: Skinner, Susan | C7: SN | D7: W35 | E7: 31:26 | F7: 8 | G7: 23:26 | H7: 95 | I7: 12
A8: 7 | B8: Pitcher, A | C8: DFOK | D8: M35 | E8: 30:05 | F8: 5 | G8: 25:05 | H8: 94 | I8: 7
A9: 8 | B9: Moulding, R | C9: HH | D9: M55 | E9: 31:10 | F9: 6 | G9: 25:10 | H9: 93 | I9: 11
A10: 9 | B10: Warren, Ken | C10: TVOC | D10: M40 | E10: 38:04 | F10: 12 | G10: 26:04 | H10: 92 | I10: 26
A11: 10 | B11: Hingley, Angela | C11: GO | D11: W21 | E11: 33:08 | F11: 7 | G11: 26:08 | H11: 91 | I11: 17
A12: 11 | B12: Farmhall, Justin | C12: SO | D12: M21 | E12: 33:17 | F12: 7 | G12: 26:17 | H12: 90 | I12: 19
A13: 12 | B13: Bush, Nigel | C13: MV | D13: M45 | E13: 30:06 | F13: 3 | G13: 27:06 | H13: 89 | I13: 8
A14: 13 | B14: Errington,Simon | C14: HH | D14: M35 | E14: 28:08 | F14: 1 | G14: 27:08 | H14: 88 | I14: 5
A15: 14 | B15: Swallow, C | C15: SN | D15: M40 | E15: 33:11 | F15: 6 | G15: 27:11 | H15: 87 | I15: 18
A16: 15 | B16: Errington, Helen | C16: HH | D16: W40 | E16: 36:14 | F16: 9 | G16: 27:14 | H16: 86 | I16: 22
A17: 16 | B17: Flint, Richard | C17: BKO | D17: M16 | E17: 33:24 | F17: 6 | G17: 27:24 | H17: 85 | I17: 21
A18: 17 | B18: Cunnane, James | C18: CLYDE | D18: M35 | E18: 32:13 | F18: 5 | G18: 27:26 | H18: 84 | I18: 13
A19: 18 | B19: McKerrow,D | C19: SLOW | D19: M45 | E19: 30:38 | F19: 3 | G19: 27:38 | H19: 83 | I19: 9
A20: 19 | B20: Darley, Jon | C20: GO | D20: M35 | E20: 32:48 | F20: 5 | G20: 27:48 | H20: 82 | I20: 15
A21: 20 | B21: Kingdon,A | C21: SAX | D21: W45 | E21: 38:02 | F21: 10 | G21: 28:02 | H21: 81 | I21: 25
A22: 21 | B22: Rose,M | C22: BADO | D22: M16 | E22: 41:26 | F22: 13 | G22: 28:26 | H22: 80 | I22: 31
A23: 23 | B23: Rogers,T | C23: SLOW | D23: M21 | E23: 29:23 | F23: 0 | G23: 29:23 | H23: 79 | I23: 6
A24: 22 | B24: Fox, P | C24: SN | D24: M35 | E24: 30:53 | F24: 1 | G24: 29:53 | H24: 78 | I24: 10
A25: 24 | B25: Greenwood,Simon | C25: SAX | D25: M45 | E25: 33:03 | F25: 3 | G25: 30:03 | H25: 77 | I25: 16
A26: 25 | B26: Davies, John | C26: MV | D26: M60 | E26: 42:04 | F26: 12 | G26: 30:04 | H26: 76 | I26: 33
A27: 26 | B27: Cheesman, MJ | C27: MV | D27: M21 | E27: 37:42 | F27: 7 | G27: 30:42 | H27: 75 | I27: 24
A28: 27 | B28: Blake, Jack | C28: MV | D28: M75 | E28: 54:43 | F28: 24 | G28: 30:43 | H28: 74 | I28: 53
A29: 28 | B29: McKerrow,A | C29: SLOW | D29: W16 | E29: 48:55 | F29: 17 | G29: 31.55 | H29: 73 | I29: 45
A30: 29 | B30: Chapman,Peter | C30: SO | D30: M35 | E30: 32:17 | F30: 1 | G30: 31:17 | H30: 72 | I30: 14
A31: 30 | B31: Birdseye, Greg | C31: LOK | D31: M55 | E31: 37:33 | F31: 6 | G31: 31:33 | H31: 71 | I31: 23
A32: 31 | B32: Rose, L | C32: BADO | D32: M45 | E32: 41:42 | F32: 10 | G32: 31:42 | H32: 70 | I32: 32
A33: 32 | B33: Griffiths, Bill | C33: SAX | D33: M50 | E33: 42:48 | F33: 11 | G33: 31:48 | H33: 69 | I33: 34
A34: 33 | B34: Saunders, Alison | C34: HH | D34: W40 | E34: 41:09 | F34: 9 | G34: 32:09 | H34: 68 | I34: 30
A35: 34 | B35: Evans, Andrew | C35: DFOK | D35: M45 | E35: 39:18 | F35: 7 | G35: 32:18 | H35: 67 | I35: 28
A36: 35 | B36: Brown, Lesley | C36: HH | D36: W50 | E36: 50:30 | F36: 18 | G36: 32:30 | H36: 66 | I36: 49
A37: 36 | B37: Rose, C | C37: BADO | D37: W45 | E37: 43:15 | F37: 10 | G37: 33:15 | H37: 65 | I37: 35
A38: 37 | B38: Townley, Laurence | C38: MV | D38: M21 | E38: 33:17 | F38: 0 | G38: 33:17 | H38: 64 | I38: 19
A39: 38 | B39: Thomas, Jenny | C39: SLOW | D39: W21 | E39: 44:36 | F39: 11 | G39: 33:36 | H39: 63 | I39: 39
A40: 39 | B40: Waller, Anthony | C40: HAVOC | D40: M21 | E40: 44:25 | F40: 10 | G40: 34:25 | H40: 62 | I40: 37
A41: 40 | B41: Thomas, David | C41: SN | D41: M65 | E41: 44:51 | F41: 10 | G41: 34:51 | H41: 61 | I41: 41
A42: 41 | B42: Float, David | C42: HAVOC | D42: M21 | E42: 44:56 | F42: 10 | G42: 34:56 | H42: 60 | I42: 42
A43: 42 | B43: Kingdon,David | C43: SAX | D43: M50 | E43: 39:18 | F43: 4 | G43: 35:18 | H43: 59 | I43: 28
A44: 43 | B44: Steadman,Margaret | C44: MV | D44: W65 | E44: 59:20 | F44: 24 | G44: 35:20 | H44: 58 | I44: 61
A45: 44 | B45: Goldingay, H | C45: HH | D45: M50 | E45: 47:09 | F45: 11 | G45: 36:09 | H45: 57 | I45: 44
A46: 45 | B46: Taylor,J | C46: CHIG | D46: W55 | E46: 54:58 | F46: 17 | G46: 37:58 | H46: 56 | I46: 54
A47: 46 | B47: Normand, G | C47: HH | D47: M55 | E47: 44:28 | F47: 6 | G47: 38:28 | H47: 55 | I47: 38
A48: 47 | B48: Blundell, Sarah | C48: DFOK | D48: W35 | E48: 50:32 | F48: 12 | G48: 38:32 | H48: 54 | I48: 50
A49: 48 | B49: Newton, Geoff | C49: MV | D49: M55 | E49: 44:43 | F49: 6 | G49: 38:43 | H49: 53 | I49: 40
A50: 49 | B50: Booth,Tim | C50: BKO | D50: M45 | E50: 49:24 | F50: 10 | G50: 39:24 | H50: 52 | I50: 47
A51: 50 | B51: McDonald, T.M. | C51: MV | D51: M55 | E51: 49:34 | F51: 10 | G51: 39:34 | H51: 51 | I51: 48
A52: 51 | B52: Buckle, Chris | C52: MV | D52: M45 | E52: 43:21 | F52: 3 | G52: 40:21 | H52: 50 | I52: 36
A53: 52 | B53: Parmenter, G | C53: HAVOC | D53: M55 | E53: 46:24 | F53: 6 | G53: 40:24 | H53: 49 | I53: 43
A54: 53 | B54: Walker,Hugh | C54: MV | D54: M45 | E54: 50:40 | F54: 10 | G54: 40:40 | H54: 48 | I54: 51
A55: 54 | B55: Bush, Cyd | C55: MV | D55: W45 | E55: 58:11 | F55: 17 | G55: 41:11 | H55: 47 | I55: 60
A56: 55 | B56: Brown, Eric | C56: HH | D56: M50 | E56: 53:05 | F56: 11 | G56: 42:05 | H56: 46 | I56: 52
A57: 56 | B57: Galvin, Catherine | C57: LOK | D57: W35 | E57: 56:16 | F57: 12 | G57: 44:16 | H57: 45 | I57: 56
A58: 57 | B58: Dunnett, Maurice | C58: MV | D58: M55 | E58: 57:25 | F58: 13 | G58: 44:25 | H58: 44 | I58: 58
A59: 58 | B59: Biggs, Janet | C59: HAVOC | D59: W45 | E59: 62:20 | F59: 17 | G59: 45:20 | H59: 43 | I59: 63
A60: 59 | B60: Sutton,Graham | C60: MV | D60: M50 | E60: 49:23 | F60: 4 | G60: 45:23 | H60: 42 | I60: 46
A61: 60 | B61: Buckle,Martine | C61: MV | D61: W45 | E61: 56:26 | F61: 10 | G61: 46:26 | H61: 41 | I61: 57
A62: 61 | B62: Turner, Teresa | C62: SLOW | D62: W50 | E62: 57:28 | F62: 11 | G62: 46:28 | H62: 40 | I62: 59
A63: 62 | B63: Oxburgh, Ursula | C63: SLOW | D63: W65 | E63: 66:17 | F63: 17 | G63: 49:17 | H63: 39 | I63: 65
A64: 63 | B64: Float, John | C64: HAVOC | D64: M70 | E64: 61:41 | F64: 22 | G64: 49:41 | H64: 38 | I64: 62
A65: 64 | B65: Webster, C P | C65: HH | D65: M50 | E65: 55:03 | F65: 4 | G65: 51:03 | H65: 37 | I65: 55
A66: 65 | B66: Greaves,J | C66: TVOC | D66: M60 | E66: 69:09 | F66: 15 | G66: 54:09 | H66: 36 | I66: 66
A67: 66 | B67: Barris, R | C67: HH | D67: M65 | E67: 65:10 | F67: 10 | G67: 55:10 | H67: 35 | I67: 64
A68: 67 | B68: Crisp, Pamela | C68: MV | D68: W50 | E68: 74:38 | F68: 18 | G68: 56:38 | H68: 34 | I68: 67
A69: 68 | B69: Frayne, Ian | C69: Ind | D69: M40 | E69: 76:29 | F69: 12 | G69: 64:29 | H69: 33 | I69: 69
A70: 69 | B70: Mealin, A | C70: Ind | D70: M35 | E70: 75:53 | F70: 11 | G70: 64:53 | H70: 32 | I70: 68
A71: 70 | B71: Goldingay, F | C71: HH | D71: W50 | E71: 82:59 | F71: 18 | G71: 64:59 | H71: 31 | I71: 70
A72: 71 | B72: Turner, M | C72: MV | D72: M70 | E72: 109:30 | F72: 16 | G72: 93:30 | H72: 30 | I72: 71
A73: mp | B73: Whitehead, Roy | C73: MV | D73: M70 | E73: 40:18
A74: mp | B74: Normand, P | C74: HH | D74: M21 | E74: 49:14
A75: mp | B75: Walker,Andrew | C75: MV | D75: M14 | E75: 69:37
B80: MV | C80: 100 | D80: 97 | E80: 96 | F80: 89 | G80: 76 | H80: 75 | J80: =SUM(C80:I80) -> 533
B81: HH | C81: 93 | D81: 88 | E81: 86 | F81: 68 | G81: 66 | H81: 57 | J81: =SUM(C81:I81) -> 458
B82: SLOW | C82: 83 | D82: 79 | E82: 73 | F82: 63 | G82: 40 | H82: 39 | J82: =SUM(C82:I82) -> 377
B83: SN | C83: 95 | D83: 87 | E83: 78 | F83: 61 | J83: =SUM(C83:I83) -> 321
B84: SAX | C84: 81 | D84: 77 | E84: 69 | F84: 59 | J84: =SUM(C84:I84) -> 286
B85: GO | C85: 99 | D85: 91 | E85: 82 | J85: =SUM(C85:I85) -> 272
B86: SO | C86: 98 | D86: 90 | E86: 72 | J86: =SUM(C86:I86) -> 260
B87: HAVOC | C87: 62 | D87: 60 | E87: 49 | F87: 43 | G87: 38 | J87: =SUM(C87:I87) -> 252
B88: DFOK | C88: 94 | D88: 67 | E88: 54 | J88: =SUM(C88:I88) -> 215
B89: BADO | C89: 80 | D89: 70 | E89: 65 | J89: =SUM(C89:I89) -> 215
B90: BKO | C90: 85 | D90: 52 | J90: =SUM(C90:I90) -> 137
B91: TVOC | C91: 92 | D91: 36 | J91: =SUM(C91:I91) -> 128
B92: LOK | C92: 71 | D92: 45 | J92: =SUM(C92:I92) -> 116
B93: CHIG | C93: 56 | J93: =SUM(C93:I93) -> 56

A1: Mole Valley Orienteering Club Back to home page