B1: MOLE VALLEY ORIENTEERING CLUB | Home Page | The Mole Roll | Event Results | | Permanent O Courses | Your First Orienteering Event | | O Jargon Buster | O Events Calendar | | Join Mole Valley | Club Management | Club Contacts |

A1: REIGATE PRIORY SPORT FESTIVAL 14 JULY 2002 Go to top of page. Go to top of home page

A3: Mathew & Christopher Colacchio | B3: 8 & 6 | C3: 0.58819444444444446 | D3: 0.59054398148148146 | E3: =D3-C3 -> 2.3495370370369972E-3
A4: Amber Try | B4: 5 | C4: 0.59340277777777783 | D4: 0.59687500000000004 | E4: =D4-C4 -> 3.4722222222222099E-3
A5: Amber & Chris Try | B5: 5 | C5: 0.60474537037037035 | D5: 0.60767361111111107 | E5: =D5-C5 -> 2.9282407407407174E-3
A6: Jonathan Try | B6: 6 | C6: 0.61024305555555558 | D6: 0.61296296296296293 | E6: =D6-C6 -> 2.7199074074073515E-3
A7: Dyson Family | B7: 13 & 10 | C7: 0.61250000000000004 | D7: 0.61451388888888892 | E7: =D7-C7 -> 2.0138888888888706E-3
A8: Williamson Family | B8: 12 & 14 | C8: 0.61284722222222221 | D8: 0.61527777777777781 | E8: =D8-C8 -> 2.4305555555556024E-3
A9: Micheal Try | B9: 3 | C9: 0.61643518518518514 | D9: 0.62083333333333335 | E9: =D9-C9 -> 4.3981481481482065E-3
A10: Sara Nesbitt | B10: 10 | C10: 0.62222222222222223 | D10: 0.625 | E10: =D10-C10 -> 2.7777777777777679E-3
A11: Chris Andrews | B11: 8 | C11: 0.62708333333333333 | D11: 0.6297800925925926 | E11: =D11-C11 -> 2.6967592592592737E-3
A12: Mike Andrews | B12: 10 | C12: 0.62708333333333333 | D12: 0.62962962962962965 | E12: =D12-C12 -> 2.5462962962963243E-3
A13: Martin Andrews | B13: adult | C13: 0.62708333333333333 | D13: 0.62991898148148151 | E13: =D13-C13 -> 2.8356481481481843E-3
A14: Alison Andrews | B14: adult | C14: 0.62708333333333333 | D14: 0.62989583333333332 | E14: =D14-C14 -> 2.8124999999999999E-3
A15: Kelly Maynard | B15: 8 | C15: 0.6381944444444444 | D15: 0.64216435185185183 | E15: =D15-C15 -> 3.9699074074074359E-3
A16: Ryan Maynard | B16: 11 | C16: 0.6381944444444444 | D16: 0.64224537037037044 | E16: =D16-C16 -> 4.0509259259260411E-3
A17: Leanne Skeen | B17: 11 | C17: 0.65949074074074077 | D17: 0.66468749999999999 | E17: =D17-C17 -> 5.1967592592592204E-3
A18: Emma | B18: 7 | C18: 0.66076388888888882 | D18: 0.66666666666666663 | E18: =D18-C18 -> 5.9027777777778123E-3
A19: Joe Jones | B19: 9 | C19: 0.66539351851851858 | D19: 0.67001157407407408 | E19: =D19-C19 -> 4.6180555555555003E-3
A20: James Williamson | B20: 14 | C20: 0.61736111111111114 | D20: 0.61932870370370374 | E20: =D20-C20 -> 1.9675925925926041E-3
A22: Well done all those who took part
A23: Thank you to Pamela Crisp for helping on the day.

A1: Mole Valley Orienteering Club Back to home page