A1: Age | B1: Rate | C1: x | D1: Dist | E1: = | F1: Target time | H1: Age group | I1: mins/km | J1: x | K1: Dist | L1: = | M1: Target time | P1: Name | Q1: Act class | R1: Class run | S1: up/down | T1: Target time | U1: Minutes | V1: % of target
F2: mins | M2: mins
A3: M 10 A | B3: 9.25 | C3: x | D3: 2.1 | E3: = | F3: =B3*D3 -> 19.425000000000001 | G3: JX2 | H3: W 10 A | I3: 10 | J3: x | L3: = | M3: =I3*K3 -> 0.0 | P3: Stephen Green | Q3: M12 | R3: JM2 | S3: down | T3: =F3*B4/B3 -> 18.9 | U3: 41.266666666666666 | V3: =U3/T3*100 -> 218.34215167548496
A4: M 12 A | B4: 9 | C4: x | E4: = | F4: =B4*D4 -> 0.0 | G4: JX3 | H4: W 12 A | I4: 10.25 | J4: x | L4: = | M4: =I4*K4 -> 0.0 | P4: Tony Burton | Q4: M40 | R4: M21L | S4: up | T4: =F9*B11/B9 -> 77.5 | U4: 66.61666666666666 | V4: =U4/T4*100 -> 85.956989247311824
A5: M 14 A | B5: 8.75 | C5: x | E5: = | F5: =B5*D5 -> 0.0 | G5: JX4 | H5: W 14 A | I5: 10.25 | J5: x | L5: = | M5: =I5*K5 -> 0.0 | P5: Mark Rowe | Q5: M21 | R5: M21L | T5: =F9 -> 70.0 | U5: 84.05 | V5: =U5/T5*100 -> 120.07142857142856
A6: M 16 A | B6: 8.25 | C6: x | E6: = | F6: =B6*D6 -> 0.0 | G6: JX5 | H6: W 16 A | I6: 10 | J6: x | L6: = | M6: =I6*K6 -> 0.0 | P6: Mark Cheesman | Q6: M35 | R6: M35L | T6: =F10 -> 61.625 | U6: 83.483333333333334 | V6: =U6/T6*100 -> 135.46991210277216
A7: M 18 A | B7: 7.75 | C7: x | E7: = | F7: =B7*D7 -> 0.0 | H7: W 18 A | I7: 9.5 | J7: x | L7: = | M7: =I7*K7 -> 0.0 | P7: Neil Lewer | Q7: M35 | R7: M35S | T7: =F27 -> 39.875 | U7: 84.666666666666671 | V7: =U7/T7*100 -> 212.33019853709513
A8: M 20 L | B8: 7.5 | C8: x | E8: = | F8: =B8*D8 -> 0.0 | H8: W 20 L | I8: 9.25 | J8: x | L8: = | M8: =I8*K8 -> 0.0 | P8: Antony Schofield | Q8: M40 | R8: M40S | T8: =F28 -> 42.625 | U8: 67.65 | V8: =U8/T8*100 -> 158.70967741935485
A9: M 21 L | B9: 7 | C9: x | D9: 10.0 | E9: = | F9: =B9*D9 -> 70.0 | H9: W 21 L | I9: 8.75 | J9: x | K9: 7.1 | L9: = | M9: =I9*K9 -> 62.125 | P9: Nick Green | Q9: M40 | R9: M40L | T9: =F11 -> 65.875 | U9: 72.65 | V9: =U9/T9*100 -> 110.28462998102468
A10: M 35 L | B10: 7.25 | C10: x | D10: 8.5 | E10: = | F10: =B10*D10 -> 61.625 | H10: W 35 L | I10: 9.5 | J10: x | K10: 5.5 | L10: = | M10: =I10*K10 -> 52.25 | P10: Peter Martin | Q10: M40 | R10: M40S | T10: =F28 -> 42.625 | U10: 72.733333333333334 | V10: =U10/T10*100 -> 170.63538611925708
A11: M 40 L | B11: 7.75 | C11: x | D11: 8.5 | E11: = | F11: =B11*D11 -> 65.875 | H11: W 40 L | I11: 10 | J11: x | K11: 5.5 | L11: = | M11: =I11*K11 -> 55.0 | P11: Steve Poulton | Q11: M45 | R11: M40S | T11: =F28 -> 42.625 | U11: 62.483333333333334 | V11: =U11/T11*100 -> 146.58846529814272
A12: M 45 L | B12: 8.5 | C12: x | D12: 7.1 | E12: = | F12: =B12*D12 -> 60.35 | H12: W 45 L | I12: 10.75 | J12: x | K12: 4.6 | L12: = | M12: =I12*K12 -> 49.45 | P12: Ian Ditchfield | Q12: M45 | R12: M45L | T12: =F12 -> 60.35 | U12: 44.95 | V12: =U12/T12*100 -> 74.482187241093641
A13: M 50 L | B13: 8.75 | C13: x | D13: 7.1 | E13: = | F13: =B13*D13 -> 62.125 | H13: W 50 L | I13: 11.25 | J13: x | K13: 4.6 | L13: = | M13: =I13*K13 -> 51.75 | P13: Nigel Bush | Q13: M45 | R13: M45L | T13: =F12 -> 60.35 | U13: 55.083333333333336 | V13: =U13/T13*100 -> 91.273128969897826
A14: M 55 L | B14: 9.25 | C14: x | D14: 5.5 | E14: = | F14: =B14*D14 -> 50.875 | H14: W 55 L | I14: 12.25 | J14: x | K14: 4.0 | L14: = | M14: =I14*K14 -> 49.0 | P14: Mike Elliot | Q14: M50 | R14: M40L | S14: up | T14: =F11*B13/B11 -> 74.375 | U14: 71.75 | V14: =U14/T14*100 -> 96.470588235294116
A15: M 60 L | B15: 10.25 | C15: x | D15: 5.5 | E15: = | F15: =B15*D15 -> 56.375 | H15: W 60 L | I15: 13.5 | J15: x | K15: 4.0 | L15: = | M15: =I15*K15 -> 54.0 | P15: George Engelhardt | Q15: M50 | R15: M50S | T15: =F30 -> 40.25 | U15: 58.40 | V15: =U15/T15*100 -> 145.09316770186336
A16: M 65 L | B16: 11 | C16: x | D16: 4.6 | E16: = | F16: =B16*D16 -> 50.6 | H16: W 65 L | I16: 14.75 | J16: x | K16: 3.3 | L16: = | M16: =I16*K16 -> 48.674999999999997 | P16: Philip Gristwood | Q16: M55 | R16: M55L | T16: =F$14 -> 50.875 | U16: 62.633333333333333 | V16: =U16/T16*100 -> 123.1122031122031
A17: M 70 L | B17: 12.25 | C17: x | D17: 4.0 | E17: = | F17: =B17*D17 -> 49.0 | H17: W 70 L | I17: 16.25 | J17: x | K17: 3.3 | L17: = | M17: =I17*K17 -> 53.625 | P17: Jon Moore | Q17: M55 | R17: M55L | T17: =F$14 -> 50.875 | U17: 67.666666666666671 | V17: =U17/T17*100 -> 133.00573300573302
A18: M 75 L | B18: 13.5 | C18: x | D18: 3.3 | E18: = | F18: =B18*D18 -> 44.55 | H18: W 75 L | I18: 17.75 | J18: x | K18: 2.7 | L18: = | M18: =I18*K18 -> 47.924999999999997 | P18: Geoff Newton | Q18: M55 | R18: M55L | T18: =F$14 -> 50.875 | U18: 54.116666666666667 | V18: =U18/T18*100 -> 106.37182637182639
P19: Simon Ling | Q19: M55 | R19: M55L | T19: =F$14 -> 50.875 | U19: 55.90 | V19: =U19/T19*100 -> 109.87714987714988
A20: M 10 B | B20: 9.25 | C20: x | E20: = | F20: =B20*D20 -> 0.0 | H20: W 10 B | I20: 10 | J20: x | L20: = | M20: =I20*K20 -> 0.0 | P20: Peter Heywood | Q20: M55 | R20: M55L | T20: =F$14 -> 50.875 | U20: 59.90 | V20: =U20/T20*100 -> 117.73955773955774
A21: M 12 B | B21: 9 | C21: x | E21: = | F21: =B21*D21 -> 0.0 | H21: W 12 B | I21: 10.25 | J21: x | L21: = | M21: =I21*K21 -> 0.0 | P21: John Davies | Q21: M65 | R21: M60L | S21: up | T21: =F$15*B16/B15 -> 60.5 | U21: 62.666666666666664 | V21: =U21/T21*100 -> 103.58126721763085
A22: M 14 B | B22: 8.75 | C22: x | E22: = | F22: =B22*D22 -> 0.0 | H22: W 14 B | I22: 10.25 | J22: x | L22: = | M22: =I22*K22 -> 0.0 | P22: Bill Alexander | Q22: M60 | R22: M60L | T22: =F$15 -> 56.375 | U22: 84.683333333333337 | V22: =U22/T22*100 -> 150.21433850702144
A23: M 16 B | B23: 8.25 | C23: x | E23: = | F23: =B23*D23 -> 0.0 | H23: W 16 B | I23: 10 | J23: x | L23: = | M23: =I23*K23 -> 0.0 | P23: Philip Winn | Q23: M60 | R23: M60L | T23: =F$15 -> 56.375 | U23: mp
A24: M 18 B | B24: 7.75 | C24: x | E24: = | F24: =B24*D24 -> 0.0 | H24: W 18 B | I24: 9.5 | J24: x | L24: = | M24: =I24*K24 -> 0.0 | P24: Roy Whitehead | Q24: M70 | R24: M70L | T24: =F17 -> 49.0 | U24: 92.30 | V24: =U24/T24*100 -> 188.36734693877551
A25: M 20 S | B25: 7.5 | C25: x | E25: = | F25: =B25*D25 -> 0.0 | H25: W 20 S | I25: 9.25 | J25: x | L25: = | M25: =I25*K25 -> 0.0 | P25: Pat Nelson | Q25: M75 | R25: M75L | T25: =F18 -> 44.55 | U25: 70.75 | V25: =U25/T25*100 -> 158.81032547699218
A26: M 21 S | B26: 7 | C26: x | D26: 7.1 | E26: = | F26: =B26*D26 -> 49.7 | H26: W 21 S | I26: 8.75 | J26: x | K26: 4.6 | L26: = | M26: =I26*K26 -> 40.25 | P26: John Lear | Q26: M80 | R26: M75S | S26: up | T26: =F35 -> 36.45 | U26: mp
A27: M 35 S | B27: 7.25 | C27: x | D27: 5.5 | E27: = | F27: =B27*D27 -> 39.875 | H27: W 35 S | I27: 9.5 | J27: x | K27: 4.0 | L27: = | M27: =I27*K27 -> 38.0 | P27: Julie MacDonald | Q27: W40 | R27: W40S | T27: =M28 -> 40.0 | U27: 48.81666666666667 | V27: =U27/T27*100 -> 122.04166666666667
A28: M 40 S | B28: 7.75 | C28: x | D28: 5.5 | E28: = | F28: =B28*D28 -> 42.625 | H28: W 40 S | I28: 10 | J28: x | K28: 4.0 | L28: = | M28: =I28*K28 -> 40.0 | P28: Pamela Crisp | Q28: W50 | R28: W50S | T28: =M30 -> 30.375 | U28: 51.10 | V28: =U28/T28*100 -> 168.23045267489712
A29: M 45 S | B29: 8.5 | C29: x | D29: 4.6 | E29: = | F29: =B29*D29 -> 39.1 | H29: W 45 S | I29: 10.75 | J29: x | K29: 3.3 | L29: = | M29: =I29*K29 -> 35.475000000000001 | P29: Julianna Grant | Q29: W55 | R29: W55L | T29: =M14 -> 49.0 | U29: 42.20 | V29: =U29/T29*100 -> 86.122448979591852
A30: M 50 S | B30: 8.75 | C30: x | D30: 4.6 | E30: = | F30: =B30*D30 -> 40.25 | H30: W 50 S | I30: 11.25 | J30: x | K30: 2.7 | L30: = | M30: =I30*K30 -> 30.375 | P30: Cynthia Ling | Q30: W60 | R30: W60S | T30: =M32 -> 36.45 | U30: 74.30 | V30: =U30/T30*100 -> 203.84087791495196
A31: M 55 S | B31: 9.25 | C31: x | D31: 4.0 | E31: = | F31: =B31*D31 -> 37.0 | H31: W 55 S | I31: 12.25 | J31: x | K31: 2.7 | L31: = | M31: =I31*K31 -> 33.075000000000003 | P31: Margaret Stedman | Q31: W65 | R31: W65L | T31: =M16 -> 48.674999999999997 | U31: mp
A32: M 60 S | B32: 10.25 | C32: x | D32: 3.3 | E32: = | F32: =B32*D32 -> 33.825000000000003 | H32: W 60 S | I32: 13.5 | J32: x | K32: 2.7 | L32: = | M32: =I32*K32 -> 36.45
A33: M 65 S | B33: 11 | C33: x | D33: 3.3 | E33: = | F33: =B33*D33 -> 36.3 | H33: W 65 S | I33: 14.75 | J33: x | K33: 2.7 | L33: = | M33: =I33*K33 -> 39.825000000000003
A34: M 70 S | B34: 12.25 | C34: x | D34: 2.7 | E34: = | F34: =B34*D34 -> 33.075000000000003 | H34: W 70 S | I34: 16.25 | J34: x | K34: 2.7 | L34: = | M34: =I34*K34 -> 43.875
A35: M 75 S | B35: 13.5 | C35: x | D35: 2.7 | E35: = | F35: =B35*D35 -> 36.45 | H35: W 75 S | I35: 17.75 | J35: x | K35: 2.7 | L35: = | M35: =I35*K35 -> 47.924999999999997
M37: 10 | N37: 290
A38: 1 | B38: M21L | M38: 8.5 | N38: 270
A39: 2 | B39: M35L, M40L | M39: 7.1 | N39: 225
A40: 3 | B40: M45L, M50L, M21S; W21L; JM5L | M40: 5.5 | N40: 215
A41: 4 | B41: M55L, M60L, M35S, M40S; W35L, W40L; JM5M, JW5L | M41: 4.6 | N41: 185
A42: 5 | B42: M65L, M45S, M50S, M21V; W45L, W50L, W21S | M42: 4 | N42: 150
A43: 6 | B43: M70L, M55S; W55L, W60L, W35S, W40S,
B44: JM5S, JW5S | M44: 3.3 | N44: 100
A45: 7 | B45: M75L, M60S, M65S; W65L, W70L, W45S, W21V | M45: 2.7 | N45: 105
A46: 8 | B46: M70S, M75S; W75L, W50S, W55S W60S, W65S, W70S, W75S | M46: 3.6 | N46: 150
A47: 9 | B47: JM4, JW4 | M47: 2.9 | N47: 105
A48: 10 | B48: JM3, JW3 | M48: 2.1 | N48: 85
A49: 11 | B49: JM2, JW2 | M49: 1.8 | N49: 55
A50: 12 | B50: JM1, JW1 | M50: 3.6 | N50: 150
B51: LIGHT GREEN | M51: 2.9 | N51: 105
B52: ORANGE | M52: 2.1 | N52: 85
B53: YELLOW | M53: 1.8 | N53: 55
B54: WHITE